,Review
100,I am not sure if the cellar door ringwood or Stomping ground is better. Both amazingly and  the best brewery and beer. I keep coming back to the stomping ground purely based on the great beer and so much to offer. The staff are friendly and most welcoming. I learnt to take a bus ride to stomping ground on a Friday enjoy a Gibbs pint or in a jug before heading to the footy. The place has a great vibe and atmosphere and looking forward to catching up with friends their soon. Highly recommend..
101,"Very cosy brewpub with heaters & reasonably interesting craft beers. Clean comfy design of this restaurant too.The food is nice for eating with beer. But I just feel that the burger needs a revamp. The patty is boring and not really juicy, slightly tough. And I also think the condiments and sauces in it need to be redesigned too. Not just with aioli.. I want a burger to taste as if a chef has passionately thought about every ingredient going into it, I don’t want it to taste like they’ve just put a burger on the menu for the sake of putting a burger on the menu and not cared to make it taste as best they can.They have some indoor plants and a fireplace in the middle of the dining room.The kitchen and the brewery are also visible from the dining room.I recommend the brown ale 👍"
102,Stomping Ground is an awesome place to hold an event/function! My daughter and I chose here for my son's 30th and what a great decision that was.First contact with Rachael was fantastic and she knew exactly what we would need/want..so thanks.(We would have had way too much food if I was left to do it lol)Venue is great ..atmosphere fabulous...staff awesome....food and drinks great!!!On the night Liz could not have done more for us to give us the best and easiest experience!! We had fun ..so thanks Stomping Ground we'll be back.
103,"Really bad experience with the person at the door, I’m 7 and half months pregnant and asked the guy at the door (came in by myself to meet my friends) to get in as I really need to use the restrooms and he said I needed to wait like everyone else and star yelling to everyone else that someone wanted to jump into the queue and made pejorative comments like pregnant women shouldn’t be going out and trying to get into busy places. It could be a nice place, but made me feel very uncomfortable."
104,"What an awesome space! The plants, the big fireplace, the open plan, it's all great. And, the variety in beers and pizza means you can keep coming back and try something different every time.We organised a Sunday afternoon event here in the courtyard and it was perfect. It is a popular and busy place but all the people at stomping ground went out of their way to make sure our party was looked after and had everything we needed. The events team were really helpful in the lead up to the event and made everything so seamless - from confirming the space, organising the food and providing advice on how to make it the best event.Just a great place to head down with a group of people. And, the perfect option for an event if you want everything organised so you can just enjoy your time with everyone!"
105,"Apart from their great brews, we experienced excellent customer service at Stomping Ground on a busy Sunday - when told that our food order would take longer than usual, we asked if we could cancel our order (which had already been put through to the kitchen). Our server (with North American accent) could not have been more helpful, organised a refund and even refunded the cost of my drink to apologise.These guys understand customer service and turned what could have been a negative experience into a really positive one. Will definitely be back and introduce my friends to this gem."
106,"Amazing service during tough times. When let down by a courier company,Stomping ground went above and beyond to make sure I received my Order. Thank you Justin and team for your amazing care. Keep brewing the good stuff.I look forward to when we can get to the brewery again soon (hopefully)."
107,"Visiting from Coffs Harbour, great location,solid selection of beers to cater for most and allow for some experimentation. In my case it was the sour ale, enjoyed it but wouldn't brew at home. The pizza was excellent and the staff went out of there way with my query re the IBU of the Hop Stomper. My wife enjoyed the Brown Ale and the venue- highly recommend a visit."
108,"Came here per recommendation of a friend with 5 friends. All of us went to the bar and ordered our food. Came back to the table and began to drink our beers that where very tastey. Then it took almost an hour to get all of our food. Mains came before entree’s, all the food was over salted, some food was so under cooked it was in eatable with the exception of the chips, although depending on the batch where over salted as well. After trying to get the attention of several servers who didn’t seem to care that our food was late & intermittent nore did they make mention of our half eaten food and why that might be, we left hungry and unsatisfied and spent almost 45$ a head. With so many great options around, we will not be back..  To bad because the place did seem to have a nice vibe but just couldn’t follow threw."
109,"This place is the dog’s breakfast of brewery venues.The venue is giant, and includes, among other things, a fireplace, a cubby house, a retractable roof, an open kitchen, an operating brewery, and plants growing all over the place.The beers are ok, nothing special, and there are about 20 to pick from.The menu features everything from pizzas to duck confit to steak tartare. Seriously, steak tartare.I was last there on a Friday night, DJ music so loud I had to yell at my mate, and I’m not thinking I saw any of the 35 uni kids having a steak tartare with all the beers they were skulling.Ultimately, everything about Stomping Ground screams out that it is trying to be everything for everyone, and ends up being mediocre instead."
110,"Lovely beer and food, plus the food hall is really spacious. Everything’s well spaced apart and it feels like they’re taking COVID seriously while maintaining a great environment.Beer’s well priced too."
111,We booked this venue for our daughter's 1st birthday and although we arranged it all at the very last minute it was a stress free process and the staff were very helpful on the day.The only negative was that they were so busy on the day that the food took longer than expected.
112,"Although a really lovely place I must advise that one of the security guards thinks of himself as a very special man... he also believes that he is somewhat of a medical professional... when asking me to wear my mask when going to the toilet, I advised him, just as I advised the front (with no issue) that I have a medical condition and cannot wear mine. His response was an eye  roll accompanied with 'oh here we go'. For this reason I give you one star, it would have been zero if I could,  purely for the rudness and disregard for people with mental health issues!"
113,"William Angliss Institute took a couple of groups of students to see the brewery and sample the beers.The students got a lot out of it and had a great experience. Thanks to Luke for taking us through the brewery and explaining the process of making various beers. You sure have a great brewery and some amazing beers.The Gipps street Pale Ale was the winner !Do let us know when you have some new beers as we would like to sample them for the education of our valued students.Thanks again for your time and the wonderful tourKamal- Teacher, Centre for Tourism and Hospitality ManagementWilliam Angliss Institute555 Latrobe StreetMelbourne 300096062111 Phone"
114,I'm giving this place one star based on the fact that the Sat night DJ's turned up the volume on their music that it was literally impossible to hear anybody speak.At a dance club - fine.At a pub - it would be nice to be able to actually be able to hold a conversation without losing your voice and having ringing ears by the end of the night.I would have liked this place and the event I attended but the DJ's just took over and destroyed the atmosphere.TURN IT DOWN WILL YOU !!!!!?????
115,"Began a lazy Sunday pub crawl here and all of a sudden, I've annihilated myself at the first place! I couldn't help myself - I had to keep trying the beers! The beers are amazing and its awesome to see how Stomping Ground really showcases different malts, hops and yeasts! Fantastic chill environment here, especially on a balmy Spring day."
116,Good morning ladies and unlucky gentlemen to be at this establishment built on deceit and  0 trust on society.This place is appalling. My sister in law and many others have been accused of taking drugs in the bathroom and a group of 25 of us were kicked out when we were all there for a 25th birthday for a recent graduate physio. We have all as a group never touched anything and are disgusted with the way we have been treated tonight. We calmly tried to talk to all staff members and the owner of the business and no one would hear a word of the facts as they had already made their decision unfortunately..Our group had spent hundreds of dollars and it's a shame to be treated this way when trying to celebrate a momentous occasion.Highly reccomend to never come here ever.Disgusting.
117,Tried drinking the watermelon smash “refreshing” sour beer. It taste literally like Olive Oil.. I can’t believe how you could get something so wrong.The passion fruit smash is a LITTLE better but still get Olive oil.. Think you need to start again with charging me $5 a can at IGA it isn’t worth 50c
118,This would have been a 4-5 star review except for the rude arrogant judgemental woman that started behind the bar for the late shift who actually cost the venue a lot of money when our group of 30+ people walked out for her very poor judgement of the least intoxicated person in the whole venue. The other staff actually apologised for her actions.
119,"Very impressed, down from the country for the weekend, mate took me in for quick beer, ended up having 4 pints and a meal.Beer was tops as was the food fires and ombience bloody good.I'll  be back with friends.Keep  up the good work.Steve"
120,"While it seems to be a genuine craft beer brewing establishment, the lady at the bar managed to give me 2 wrong beers in the ‘core selection’ six beers tasting pad - got two beers that were hoppy and very bright in colour in lieu of a brown ale and milk stout....Pizzas are good but pricey"
121,"Fantastic ales but   it's  a beer garden but not as we know it.In the UK a beer garden does what it says on the tin, you have beer in a garden.  Here it's more of a retractable roof.Notwithstanding that it serves a great purpose when it's cool.."
122,Such a great place for a group of 20.Food is seriously good.So many beers!
123,This place ROCKS !Plain and simple.Get your butt here and have a great time.
124,"Brought my friend and her parents here for their last dinner in Australia as I’d been here a couple times before for drinks.Not gonna lie, the service was pretty non existent - the best service we probably had was our own table member going directly to the kitchen to ask for some aioli and then grabbing us some cutlery on the way back cause no one else did…Food was mixed reviews amongst the table, the drinks were good."
125,"30-something, bald, male staff member scolded me like a naughty child over a minor misunderstanding, in front of my entire group. He was unbelievably rude and condescending, and kept going at me even after I had turned away from him to try and avoid being berated further. That sort of attitude has no place in a hospitality venue at any point in the day/ night, but especially not during a relaxed family lunch. He ruined the day for me and we all left soon after."
126,"(Translated by Google) That was pretty much nothing. We wanted to see the local brewery culture and were received rather coldly. There was enough space and the service was fast. I wish there had been a little more explanation about the beer. So it seemed rather careless. That's a great pity, because the beer was great and the place was lovingly furnished! Maybe we just had a bad day. It can happen.(Original)Des war eher nichts. Wollten uns die lokale Brauerei Kultur anschauen und wurden eher kühl empfangen. Es gab genug Platz und der Service war schnell. Ich haette mir gewünscht, daß es etwas mehr Erklärung zum Bier gegeben haette. So wirkte es eher lieblos. Das ist super schade, das Bier war nämlich klasse und der Ort liebevoll eingerichtet! Vielleicht haben wir nur einen schlechten Tag erwischt. Kann ja mal passieren."
127,(Translated by Google) Great brewery with a nice restaurant.The beer tastes great and the ambience invites you to linger for a while.They are okay in price.The waitresses are very friendly and happy to help with the beer selection.I love coming here.(Original)Super Brauerei mit schönem Restaurant.Das Bier schmeckt hervorragend und das Ambiente lädt zum längeren Verweilen ein.Preislich sind sie okay.Die Bedienungen sind sehr freundlich umd helfen gerne bei der Bierauswahl.Komme sehr gerne hier her.
128,"(Translated by Google) I ordered a beer sampler, but the beer itself wasn't that impressive, but the atmosphere was really good. I went to drink beer and then went back for dessert. For dessert, I ate apple crumble and brownie ice cream.(Original)맥주 샘플러 시켰는데 맥주 자체는 그닥 인상적이지 않았지만 분위기가 참 좋았어요 다른데 맥주 마시러 갔다가 디저트 먹으러 다시 갔네요 디저트로는 애플 크럼블이랑 브라우니 아이스크림 먹었는데 애플 크럼블에 아이스크림이 있었으면 더 좋았을 거 같아요"
129,"(Translated by Google) Really a very, very nice spot with delicious craft beer, good food and nice service. It's really worth a visit - not just for craft beer lovers!(Original)Wirklich ein sehr, sehr schöner Spot mit leckerem Craft Beer, gutem Essen und nettem Service. Ein Besuch lohnt sich wirklich - nicht nur für Craft Beer Liebhaber*innen!"
130,"(Translated by Google) Good local beer at a good price for Australia, great place and good atmosphere.Recommended if you are a craft brewer.(Original)Buena cerveza local a buen precio para ser Australia, el local genial y el ambiente bueno.Recomendable si eres cervecero artesanal."
