,Review
49,"Awesome beer hall with a great selection of drinks. I booked for 12 then emailed 5 days out to increase the booking number, no response so had to call and confirm they could accommodate the change which they agreed to. Got an email back 2 days after the booking saying they hoped it worked out and I was able to accommodate everybody so not sure where the communication channels go, obviously not coherent. Food was delicious, service fast and a family (and dog) friendly atmosphere during the afternoon."
50,"We held a 60th birthday party for 60 people in the Boiler Room, a fully private area at one end of the venue.  Everyone commented what a great venue it was, with an indoor and outdoor area with a slide-able roof, how attentive and helpful the staff were and how good the food was (we had the 8 piece canapé menu).  We played our own music playlist over the sound system which worked very well.We had a fantastic night and would highly recommend the venue and the staff who were all fantastic."
51,"I had my wedding reception here and booked out the private deck for around 50 people on a Saturday and it was amazing! The booking staff were incredibly friendly, organised and accommodating to all my requests, which made for an incredibly stress-free process. Their communications throughout the lead up to the event was quick and there were no issues with anything I'd asked for. The staff on the evening took care of everything in the background and made sure the evening ran smoothly, and everyone was incredibly friendly. All of my guests loved the food, drinks, service and the casual atmosphere, which is exactly what we wanted. I would definitely book here again for an event."
52,"We hosted our staff party at Stomping Ground. And what a venue?!It has an awesome airy feel throughout with so much greenery.Our canapes package was very good value for money & so delicious. The beers were always going to be great and the service was very professional & helpful. The feedback from our staff has been very positive. ""Best staff party in years!"""
53,"Driest burger I have ever eaten. Also not tasty.Beverage service here is great. Beers and whisky good.Food service bad.If you can bring the food, why can't you clear the plates inside 45mins of finishing?"
54,"Had dinner here tonight.  What a great job Stomping Ground does to ensure a Covid safe dining experience - absolutely considerate and professional.  Beers were great as was the food.  Had been avoiding large venues like this but will be back to this one as they are doing a great job with their Covid safety practices.The pepperoni and anchovy pizzas - both outstanding, as were the hot chips.  Thanks for a good night out."
55,"Absolutely excellent selection of beers and good food in a really pleasant space. Unlike a lot of breweries, stomping ground doesn’t just do the trendy IPAs and sours, but tries to cover all styles of beer from the old and new world, which is a breath of fresh air, as for me the hoppy stuff can get really boring. A brewery for true beer lovers, with excellent food to boot, the Bavarian should take a cue from these guys’ pretzels. Will come back every time I’m in Melbourne."
56,I like this venue and of course the beer. I usually consume your products at the bottle shop or if I go to another venue must likely I’ll end up having stomping ground. But I went a two weeks ago with my partner and we have some IPA and the beer was very flat it didn’t taste like crispy yummy IPA it was more like a  flat lager.We address this to the bar tender which had a terrible attitude by saying that’s how it is… that he doesn’t taste anything different. ( we thought either he would change our beers or offer us another option/ similar I mean just give us a nice service) but no.It was disappointed  because we love your beers and by going to the brewery it self and have a flat beer and a rude attitude from your staff members just give us a very bad experience.
57,"You let me I on my bucks. I know I had probably had more drinks than you would normally allow . I understand d I had a few but you were able to see tvv mg at I actually wansnt too far gone. TVs k you for being a part of a supportive culture that allows people to celebrate without being denied/punished. Happy saturdays if a a returning customer, buck"
58,"What a great venue!The building is beautifully designed, with great detailing.However, the experience is let down by several factors:1) lack of bar staff- there were hundreds of people here this afternoon... And only three bar staff.. people were getting frustrated.2) inconsistent quality of food. Some of the pizzas were lovely...others served cold with half cooked ingredients. Chips/fries good, fried kipferler potatoes with cheese, under cooked and cold.In a venue that is above average prices(read expensive)  no matter how busy, one expects better service... especially when the staff are generally so rude.Can do better.. but because it's busy and they are making loads of money... they don't care."
59,"We went to the stomping  ground this afternoon for drinks after work . On arrival I asked if there were any restrictions on where we could sit of a time limit, I was told by the bar staff we could sit anywhere once it did not have a reserved sign . We found a table which has no reservation and ordered our food and drinks . You ordered from the table which was great and the food was nice . We were enjoying our drinks and our evening out when we were approached by a member of staff snd told we needed to leave in 15 minutes. I explained we had been told we could sit at any table and was told there were no restrictions. He went on to say when we had arrived they had not been fully booked but since then they had booked our table. I find this so rude and dismissive of our business and our group . Basically we were being dismissed because they had a better offer . I understand venues are all trying to make money but this in my opinion was rude , dismissive and terrible customer service. If this is how they treat their customers it’s very poor .The most disappointing thing is we were having a great time and would have stay and spent lots more money.It’s amazing how one person can change your whole opinion on a place and leave a very bitter taste in your mouth"
60,"Love this place. Great, but unusual beer, lovely food, nice ambience. Mr Yum, the ordering system hiding behind the QRCode was rubbish! It said do I want to create a tab. Yes, of course, I'll pay at the end of the meal. No brainer. Except it deducted the money straight away and we hadn't got the funds in that account, so it refused to use my card anymore and the bank blocked it. Rubbish!! 😄 Not Stomping Ground's fault. Pay a visit if you haven't already."
61,We had two babies in high chairs and were seated at the only table with direct sunlight at 12pm. It seemed like a huge inconvenience when we asked to move to any other table that was still empty. Other tables didn’t have bookings until 12:30pm. Food was average and to use liven you have to go to the front and again seem like a huge inconvenience. 15% surcharge on Easter Saturday seemed a bit strange given that it isn’t a public holiday.
62,"Awesome venue - during the day it’s got a really nice modern/industrial vibe; while during night its a much more pub feeling.Staff are friendly.They have a very good selection of beers and other drinks available - though sadly only two ciders, usually.Food is really good. Slightly on the pricey side. The pizzas are good, and the rump burger is delicious, with a cream cheese and chives  sauce. Its a very good size, yet comparatively light and doesn’t leave you with and overly full tummy.Chips are delicious too."
63,"Order everything from your table. Pizza steak, lamb, burgers and much more. Service is quick.Lots of in house drinks to experience: lots of in-house beers to gin.Rustic decor and ambience.A good experience get down and try."
64,"Beer is excellent. Vibe was perfect, on a Tuesday night. Food is very very good. Service is perfect. Ordering app works well.Highly recommend."
65,"I recently had some drinks for my 30th birthday at Stomping Ground and was reminded just how great a venue it is. Friendly and helpful staff, great atmosphere and most importantly, really good beer.A couple of things to note:1) I booked well in advance for a Saturday afternoon and was very glad that I did, as it was absolutely packed. If you are going to have a decent sized group, it makes sense to book well in advance.2) The only slight negative from the venue (and it is very minor) was that I was contacted the day before to confirm my booking and I mentioned that people would be coming in and out over the time of the booking. However, by about 3.30pm, there was a line for the door. Would have been nice if staff had asked if I wanted to put my name on the door just so that some of my friends could have gotten in a lot easier.Overall, a great experience - we'll definitely be back!"
66,"We have had a party for our staff recently. The venue staff were very attentive and friendly, the food was very tasty, especially eggplant chips and salmon rillette . The venue its self is combination of industrial, edgy feeling with lots of plants to soften the look. One small comment on the noise level, mainly due to the number of patrons. Otherwise worthwhile to visit."
67,"We had a very enjoyable time at Stomping Ground recently for our work Xmas party. Great food and drinks. There was a little mess up with our online food order, but they fixed the problem immediately, and gave us complimentary starters and put $100 on our bar tab, which was more than they had to and very much appreciated. Will definitely recommend this place and we will be going back again. Thanks!"
68,"We had our engagement party here over the weekend. We found the staff to be very accommodating and friendly. Our guests loved the feeling in the venue, as well as the food, which barely lasted 30 seconds when placed on the table. Really lovely venue, would highly recommend them for anyone looking for a relaxed vibe for their next occasion."
69,Food is fine if not overpriced for what you get. $50 for two mixed drinks disguised as ‘cocktail jugs’-Staff childish and entitled. ARENT UP ON CURRENT COVID LAW so generally are just sucks about irrelevant things.Save your money to spend elsewhere.
70,"Had a Sunday birthday booking for a larger group which was an easy process to follow.Overall the food and beer were good, but the stand out was the friendly and helpful staff who made every interaction a positive one.Whilst it was quite busy and wait times suffered due to this, we came away with every intention of visiting again!"
71,"I chose to hold my 40th birthday at Stomping Ground Brewery and was so thrilled with the venue (booked out the private deck area), the food (so much choice and so delicious), the drinks (great choice of beer and wine), and all the staff on the day (so helpful and lovely).I would highly recommend this venue for your party/celebration. Rachael was fantastic to work with in the lead up to the party, communication was great, and she helped guide me through the preparations to make the day go perfectly.There were so many compliments from my guests about the space, food and drinks. Thanks again Stomping Ground!"
72,"One bad egg spoils the dozen. We had our end of year break up here with a group of about 25 people, food and drink we're excellent value for $45 per head. The shift manager and bar staff were super friendly however one waiter assigned to our table made it quite clear he didn't want to be there. Several people on the table found his service and manners a bit of a downer on the night, otherwise great spot. The merchandise is good too!"
73,"Fanatics beers and a cool place. Try the nitro milk stout, the IPA and the Pridelweiss.Staff are great too! My worst fears about the Mr Yum order system came true: two identical orders from different people on the same table led to one being ignored as a duplicate. The staff were cool and understanding about it."
74,"LOVE this place. It will definitely become our new stomping ground!Update! SOOOOOOO great to come back here again!!! Scrumptious food, incredible service and amazing beers in a sensational beer hall! The perfect Melbourne venue. Can't wait to come back!"
75,"I made my maiden visit to the Stomping Ground motherlode with 5 thirsty mates last Saturday. This place is absolute legend! The beer is awesome (I'd drunk SG beers in cans many times before and there was a nice selection on tap even in crazy Covid times). The service was exceptional - we were really well looked after at our table by attentive staff offering samples, good humour and all round good vibes. The food was top tier, absolutely high end. We all had a blast even under the Covid-19 restrictions. The venue is trendy, airy and friendly. An easy recommend and I'll be back with more reinforcements guys  so keep those great beers coming!!"
76,Went out here for Father’s Day dinnerWent to order and all the pizzas were sold out and there was little to no other main meals to choose from so we ended up having to order 2-3 kids meals per person etc. Was a nice place just had no food on a busy day
77,"Been here for lunch and some drinks twice since covid restrictions were eased and restaurant dining was permitted. We were seated in the outdoor section both times as walk-in guests - we waited in line on the socially distant marks, and the sign-in process using the QR code was quick and efficient. The menu is slightly smaller than non-covid times, but all the items we ordered were delicious - in particular the hot sopressa and guanciale pizzas. Drinks were top notch as usual. Amazing experiences both times, I felt safe throughout the whole visit, kudos to staff for providing service with great hospitality. Planning to come back here many more times, especially in the hot lazy days of summer."
78,"The staff could have been friendlier - on multiple occasions there were two staff members who actively ignored us and another who was helping us with high chairs acted like we were an absolute inconvenience. However, Michelle was AMAZING! Her customer service made up for the other two, and constantly across the day she would go above and beyond for myself and my group. The atmosphere was amazing and the food was fabulous."
79,Checked out Stomping Ground for the first time last week after numerous recommendations and couldn’t have been happier with the experience. Beer garden out the back is massive with great vibes and the beers are delicious. I made a booking for 20ppl online which was so easy to do and there we no issues at all. Table with my name on it was ready when we arrived. Highly recommend checking it out.
80,"Beer great and lovely ambience. A good place for families to spend a few hours on the weekend.Wait staff are so grumpy though. Left a fair bit of our meal as it wasn't particularly nice (perhaps we ordered the wrong thing) and the waiter came up and said ""what's the deal with this?"" rather than ""can I take your plate"" or whatever. We watched another waitress see a toddler walking towards her but rather than step aside, she internationally walked in to him and had a face like a smacked...Perhaps they'd all been on the staff beer the night before!"
81,"We rented out the Courtyard space inside the venue on a Saturday night, it was awesome! Kay, Liz, Asha, and co took amazing care of us!  From the food to the beers to the entire staff, our group of friends that came (around 40) could not say enough good things.  If you want some of the absolutely best craft beer in Australia, you need to make the trek to Stomping Ground!"
82,"This brewery has an amazing and warm space with a fire and beautiful wooden decor. Pizza was delicious and other food was great too. Especially handy to have the play area for kids. Was pleased to see they had compostable straws (and a noted: if you don't need one, don't get one) and an environmentally friendly vision. Awesome place!"
83,"In a covid society, a surcharge of 1.5% just to use cashless pay. What a scam, not long ago stomping ground refused cash. Now penalising for not using cash. For an eftpos transaction the fee charged is less than 0.5% of the total. With the cost of living on such a steep rise with the average pay packet not changing, personally unsure if I can even afford that treat beer, especially when being covid safe and penalised for it. What a shame"
84,"as a brewery - good choice of beersas a venue - great decor and ambienceas a restaurant - horrible - stay away from steak (overcooked old piece of meat with a bit of greens not worth $36, not even pub grade), stuff forgot order (in an empty restaurant)"
85,"Popped in here on a Wednesday night for dinner. The atmosphere is cool with dim lighting and lots of timber. The place wasn't super busy, probably about a third full so we had our pick of tables. After placing our order at the bar we had to wait for nearly an hour for our food to arrive at which point we discovered they had taken our order down incorrectly and presented us with two side dishes instead of two mains. We didn't feel like waiting another hour for replacement meals so we just ate them and left. The food was also cold when it arrived and was extremely over priced for what it was. We will definitely not be back."
86,"Unfortunately not a great experience this time around, super short pours on all the beers and one meal came out 25 mins after the other, even though it was ordered first. The duck was preeeetty salty, even for someone like me who likes food well seasoned. Have definitely enjoyed this place in the past, perhaps tonight was an off night. Would love to see some female or diverse staff behind the bar in future too. Will surely be back, just a disappointing trip this time round 👍"
87,"Hosted my 60th Birthday Party in the deck area on Saturday October 5 2019.Excellent communication before the event and excellent service and welcome during the day.Really happy with the hospitality I was able to offer my guests, the team at Stomping Ground went out of the way to ensure we enjoyed the afternoon and that everyone had a good time.Kelvin"
88,"I was here for the beer only, so I can't comment on the food, but the beer was totally to my taste. I feel like I could go back in any of twenty different moods and there would always be something for my taste. Considering the bar was overstaffed, I could have been served quicker, but at least the bar was overstaffed so I didn't have to wait more than 30 seconds. Come to think of it, they were more interested in interacting with each other than with me, which I don't love."
89,Great hub for food and drinks. Very Melbourne with a beer hall style and rustic feel.Kids: Decent for kids too if they are conditioned to go out to pubs/cafes. A wooden play house in corner for the confident selfplay kids.Looking forward to another visit to try the menu properly.Beers: pints approx: $12.
90,"A range of interesting beers and, so far as we went, an enjoyable menu. Pizzas of a respectable size, good ingredients, well cooked, honestly priced. Not Napoli art pizza, but that's not what SGB are aiming for, and not what we wanted either, so no worries.Bar staff were friendly and knowledgeable. Floor staff . . . well, bless them, they suffer from the same hunter-and-collector directions that seem to haunt all Australian restaurants these days. Note to managers: if your crew aren't refilling those glasses and plates, and people are still eating or drinking, then leave things alone. Seems to be a Melbourne thing, or at least an Australian thing, so no points deducted, but still. [You'll hear more about this from me in future reviews].Great venue. A refurbished factory space with lots to look at for for people with an interest in architecture. Gets hot when it's north of 35 degrees, but they do their best with fans and sprays. Otherwise fine. Clean modern loos, too. Charming all 'round.On balance, it's a good time and decent value for money in this part of Melbourne.Pro-tip: this is a family-friendly place. If you have little kids and want to go out, or are cool with that vibe, it's great. If you detest little kids, or just want to drink quietly in peace with other grown-ups, you might consider more of a traditional pub."
91,"Nice place with great open atmosphere. The beer was good too.I ordered the sausage, which is essentially a single regular sausage on some chickpeas in sauce. This cost $20. While that aspect was the only small disappointment I can't help but be a little bit impressed by anyone who can sell a single sausage for $20."
92,We celebrated a 40th on a Saturday arvo & booked the deck space for 60 adults & 20+ kids. Was the perfect space as it was enclosed enough that parents didn't have to worry & with a table for activities plus the cubby house across the room the kids were occupied for hours. Staff were super helpful both in the lead up & on the day. From management ensuring the delicious food was sent out at the right time to bar staff serving up a huge range of beverages to security making sure everyone was happy & safe.It got busy as the day wore on but we were oblivious as we didn't feel at all crowded or like we had to move on.We were able to bring in some decorations & our own cake/desserts to make it a unique space for us.Highly recommend as a great daytime party venue or even just for a relaxed catch up with friends with kids or doggos!
93,"Located in a discreet area and surrounded by industrial buildings the brewery is a fit-out of large industrial warehouse, which has been renovated to provides a cool area to hangout  during the week and weekend.As mentioned by many other reviewers, great place for crafts beer and atmosphere. I was here during the weekend and it was pumping with energy, whilst the weekday offered a relax chill-out ambiance, perfect for the mid-week catch up if you're looking for a quiet night to cozy next to the fireplace.The crowd during the weekend was diverse and included friends/family catching up, parents sneaking  a 'cold-one' whilst their kids were playing in the playhouse, people predrinking before the footy game and couples.As a crafts beer brewery, the crafts beer selection was diverse and had something for everyone to enjoy from your lager to your more 'fun' beers such as a doughnut inspired beer (highly recommended) and guava beer. Definitely try the tasting paddle first since it'll give you the option to try their full range without making a large commitment to a beer you might not enjoy.Food wise, I found their side offerings such as chip and sweet potato crisps including calamari was really good and complimented the beer perfectly. However with the pizza I thought was okay and lacked a bit of punch and could use more seasoning.In terms of ambiance, the space offers a range of seating options including large tables suited for groups or smaller table suited for couples or friends. The space is filled with a lot of natural day light from the skylight and doesn't feel like a warehouse, which many similar spaces suffer. During the night, the space morphs into a cozy beer hall providing warmth from the fireplaces and privacy through the dimly lit lights."
94,"We found this delightful place about two months ago and have been returning regularly.The choice of beers is fantastic, catering for all tastes. Great food selection and the staff couldn't be more helpful.As a 'Pom', I do miss my UK Real Ale, however, with the choices on offer, it's the next best thing to a 'Warm British Pint'...Keep doing what you're doing."
95,"Great beers and atmosphere. Our food came out almost too quickly, and unfortunately it didn't impress. I had soggy boiled brussel sprouts with about 5 tiny bits of bacon with it, my partner had to return his burger as it was tiny and falling apart in his hands after 2 bites, and the Mac n Cheese that my mates had literally didn't have any cheese on it! It was a watery creamy sauce that they somehow thought could pass for cheese?! I'll go back for beers, but not for food."
96,A large well lit space with great beers and pizzas. We were with a group of about 40 and had pre-booked a small area. The security guards did a wonderful job of creating a prison-like ambience by regularly and unnecessarily telling us where we couldn’t stand on a relatively quiet night. Thank you for providing us with the rigid structure and boundaries of where we shouldn’t sit and stand. I didn’t realise it at the time but in hindsight we needed a drill Sargent managing this because we could not be trusted to congregate as we please.
97,"Beer: goodAtmosphere/decor etc: greatFood: below averageStaff: very grumpyBBQ sausage was nice, however, chickpeas were really hard and dressing tasted like a tonne of raw cumin powder - completely inedible.Halloumi dish was good, as expected. Can't really go wrong with that."
98,"Was really excited to come along, but unfortunately whole table was disappointed with meals, especially the really small amount on the ""share plates"" for the price.Excellent beer and amazing setting, but suggest you review the food so patrons don't leave feeling hungry."
99,"I had birthday drinks here last Friday. Booked a large table about 3 weeks before for the occasion. On the night most of my party had to line up in the freezing cold just to get in. I spoke with the manager and the security manager both who just told me 'bad luck'. Customer service was terrible, very obnoxious, security guards were on a real power trip. I would never book a table here again for a large group. Really put a dampner on my evening."
